<?xml version="1.0" encoding="UTF-8"?>
<relacion xmlns:xsi="http://www.w3.org/2001/XMLSchema-instance"

xsi:noNamespaceSchemaLocation="EJERCICIO1.xsd"

>
   <persona sexo="hombre" carnet="A1111">
     <nombre>Luis Martin</nombre>
     <email>luis@hotmail.com</email>
     <parentesco tipo="Padre"/>
   </persona>
   <persona sexo="mujer" carnet="B2222">
     <nombre>Laura Martin</nombre>
     <email>laura@hotmail.com</email>
     <parentesco tipo="Hija"/>
   </persona>
   <persona carnet="C3333">
     <nombre>Raul Gonzalez</nombre>
     <email>raul@hotmail.com</email>
     <email>raulin@gmail.com</email>
   </persona>
</relacion>